shortlist_priority,param_id,source_symbol,sma,fib_band,rw,eb,rw_lookback,confirm_ema_period,confirm_min_distance,total_trades,win_rate,expectancy,max_dd_pct,consistency_score,composite_score,shortlist_role,shortlist_rationale
1,short_cand_088_ETH_USDT__4h_ema20_dist0.000,ETH/USDT,75,0.586,0.011,0.023,8,20,0.0,87,0.632183908045977,2.93130815604822,1.826122828219074,4.574736251511037,93.01014540695986,primary,"Best overall short candidate after deduplication, balancing expectancy, drawdown control, and consistency."
2,short_cand_082_ETH_USDT__4h_ema20_dist0.000,ETH/USDT,75,0.486,0.011,0.023,8,20,0.0,71,0.6338028169014085,2.800783117428633,1.688627763004398,5.86690371717003,91.14493942558936,secondary,Closest clean alternate to the primary short candidate with a very similar edge profile.
3,short_cand_088_ETH_USDT__4h_ema15_dist0.000,ETH/USDT,75,0.586,0.011,0.023,8,15,0.0,75,0.6266666666666667,2.9063189671533225,1.7695810723662224,5.35232220942077,90.92777199205484,throughput_variant,Short candidate with especially strong trailing-drawdown control for the short side.
4,short_cand_076_ETH_USDT__4h_ema15_dist0.000,ETH/USDT,75,0.536,0.011,0.023,8,15,0.0,67,0.6268656716417911,2.8215836091697497,1.6804673003132566,6.171334163833919,89.53098867344941,alternate_base,Short candidate with especially strong trailing-drawdown control for the short side.
5,short_cand_067_DOGE_USDT__4h_ema20_dist0.004,DOGE/USDT,70,0.686,0.05,0.028,10,20,0.004,54,0.6296296296296297,2.8997695799849423,1.754157572530225,7.450570700764829,89.0160634121431,reserve,Short candidate with especially strong trailing-drawdown control for the short side.
